{
  "telemetry_schema": 2,
  "process_instance_id": "0198f3a0-5c11-7cb2-9b64-9cf25ab8cd10",
  "sequence": 3812,
  "observed_at_unix_ms": 1787047170000,
  "uptime_seconds": 86400,
  "version": "1.1.16-patch-v1.3.1",
  "relay_probe_protocol": 1,
  "relay_load_protocol": 1,
  "fast_media": {
    "protocol": 1,
    "enabled": true,
    "healthy": true,
    "udp_port": 22119,
    "active_allocations": 2,
    "active_streams": 1,
    "hello_accepted": 9200,
    "cookie_rejected": 3,
    "bind_succeeded": 1800,
    "bind_rejected": 5,
    "grant_rejected": 2,
    "role_mismatch": 1,
    "session_mismatch": 0,
    "allocation_mismatch": 1,
    "rebinds": 14,
    "forwarded_packets": 150000,
    "forwarded_bytes": 120000000,
    "dropped_packets": 42,
    "rate_limited": 7,
    "replay_rejected": 2,
    "expired_allocations": 12,
    "listener_failures": 0
  },
  "load_basis_points": 2375,
  "active_sessions": 19,
  "pending_pairs": 3,
  "capacity_sessions": 200,
  "bandwidth_bps": 123456700,
  "bandwidth_ema_alpha_basis_points": 2500,
  "capacity_bandwidth_bps": 1000000000,
  "draining": false,
  "admission_open": true,
  "admission_rejections": 4,
  "probe_malformed": 2,
  "probe_unsupported": 1,
  "probe_rate_limited": 8,
  "probe_successful": 9200,
  "telemetry_auth_failures": 0
}
